file_name,uni,wylie,url,dept,grade,char_len,audio_len,path,inf
STT_NS_M0518_0255_3509530_to_3512926,ག་རེ་བྱས་ནས་ལབ་པ་འདྲ་བོ་ཅིག་ཡིན་ན། པེ་ཤག་དེ་ཡོད་བ་ད་གནས་སྐབས་ཅིག་གི་ད་བདེ་བ་རཱ།  ,ga re byas nas lab pa 'dra bo cig yin na/_pe shag de yod ba da gnas skabs cig gi da bde ba rA/__,https://d38pmlk0v88drf.cloudfront.net/wav16k/STT_NS_M0518_0255_3509530_to_3512926.wav,STT_NS,3,81,3.396,wav16k/STT_NS_M0518_0255_3509530_to_3512926.wav,ག་རེ་བྱས་ནས་ལབ་པ་འདྲ་བོ་ཅིག་ཡིན་ན། པེ་ཤག་དེ་ཡོད་བ་ད་གནས་སྐབས་གཅིག་གི་ད་བདེ་བ་རཱ།
STT_NS_M0455_0392_2607934_to_2610105,གལ་སྲིད་ང་སྐུ་ལུས་མེ་སྲེག་བཏང་ན་ཨ་མ་ཁྱོད།  ,gal srid nga sku lus me sreg btang na a ma khyod/__,https://d38pmlk0v88drf.cloudfront.net/wav16k/STT_NS_M0455_0392_2607934_to_2610105.wav,STT_NS,3,43,2.171,wav16k/STT_NS_M0455_0392_2607934_to_2610105.wav,གལ་སྲིད་ང་སྐུ་ལུ་མེ་བསྲེག་བཏང་ན་ཨ་མ་ཁྱོད།
STT_NS_M0452_0277_1637344_to_1643718,ད་འདི་ལ་བློན་པོ་ཀྲི་ཤུ་ཡིན་ན་གཅིག་ལབ་མྱི་ཅིག་ཡོད་རེད་ད། བློན་པོ་བུ་ཀྲི་ཤུ། ང་ཚོའི་རྒན་ལགས་མང་པོ་ལབ་ཀི་འདུག་བ། ཀྲི་ཤ། བློན་པོ་བློན་པོ། ཨོ་བློན་པོ་ལབ་དུས་སྐབས་ལ་ད་འདི་ ,da 'di la blon po kri shu yin na gcig lab myi cig yod red da/_blon po bu kri shu/_nga tsho'i rgan lags mang po lab ki 'dug ba/_kri sha/_blon po blon po/_o blon po lab dus skabs la da 'di _,https://d38pmlk0v88drf.cloudfront.net/wav16k/STT_NS_M0452_0277_1637344_to_1643718.wav,STT_NS,3,166,6.374,wav16k/STT_NS_M0452_0277_1637344_to_1643718.wav,ད་འདི་ལ་བློན་པོ་ཀྲི་ཤུ་ཡིན་ན་གཅིག་ལབ་མྱི་ཅིག་ཡོད་རེད་ད། བློན་པོ་ཀྲི་ཤུ་ི་ང་ཚོ་རྒན་ལགས་མང་པོ་ལབ་ཀི་འདུག་བ། ཀྲི་ཤུ་ཡིན་་བླུན་པོ། བློན་པོ་ལབ་དུས་སྐབས་ལ་ད་འདི།
STT_NS_M0453_0195_1079906_to_1085213,ཀོ་ལི་གྷལ་ཡོད་རེད། བྷེ་ལ་ཀོབ་པེ་ཡོད་རེད། ཧུན་སོར་ཡོད་རེད་ང་ཚོ་གསུམ་ད་པུ་གུ་གསུམ་དེ་བསླབ་ཀྱི་ཡོད་རེད་ད་ཡོད་བ།  ,ko li g+hal yod red/_b+he la kob pe yod red/_hun sor yod red nga tsho gsum da pu gu gsum de bslab kyi yod red da yod ba/__,https://d38pmlk0v88drf.cloudfront.net/wav16k/STT_NS_M0453_0195_1079906_to_1085213.wav,STT_NS,3,110,5.307,wav16k/STT_NS_M0453_0195_1079906_to_1085213.wav,ཀོ་ལི་གྷལ་ཡོད་རེད། བེ་ལ་ཀོ་པེ་ཡོད་རེད། ཧོན་སུ་ཡོད་རེད། ང་ཚོ་གསུམ་ད་ངབུ་གུ་གསུམ་དེ་བསླབ་ཀི་ཡོད་རེད་ད་ཡོད་བ།
STT_MV0678_0335_2438508_to_2444972,ང་ད་ལྟ་སོ་སོའི་བུ་གུར་གདོང་བསྟན་ནུས་ཀི་མི་འདུག གང་ཡིན་ཟེར་ན་ངས་པ་བས་འགན་ཁྱེར་ཡོད་མ་རེད།  ,nga da lta so so'i bu gur gdong bstan nus ki mi 'dug_gang yin zer na ngas pa bas 'gan khyer yod ma red/__,https://d38pmlk0v88drf.cloudfront.net/wav16k/STT_MV0678_0335_2438508_to_2444972.wav,STT_MV,3,89,6.464,wav16k/STT_MV0678_0335_2438508_to_2444972.wav,ང་ད་ལྟ་སོ་སོའི་བུ་གུར་གདོང་བསྟན་ནུས་ཀི་མི་འདུག གང་ཡིན་ཟེར་ན། ངས་པ་ཕའི་འགན་འཁེར་ཡོད་མ་རེད།
STT_MV0678_0340_2481242_to_2484993,ཞའོ་ཤཱང་གིས་བུ་གུར་རོགས་པ་བྱས་ཕྱིན་པ་རེད། ངའི་རེ་བ་ལ་སང་ཉིན་ ,zha'o shAng gis bu gur rogs pa byas phyin pa red/_nga'i re ba la sang nyin _,https://d38pmlk0v88drf.cloudfront.net/wav16k/STT_MV0678_0340_2481242_to_2484993.wav,STT_MV,3,61,3.751,wav16k/STT_MV0678_0340_2481242_to_2484993.wav,ཞའོ་ཤཱང་གིས་བུ་གུར་རོགས་པ་བྱས་ཕྱིན་པ་རེད། ངའི་རེ་བ་ལ་སང་ཉིན།
STT_AB00304_0034_280034_to_290661,གཡེར་ཁའི་སྒྲ་ལྷང་ལྷང་ཞིག་ཐོས། ཟླ་བ་ལགས་ནས་བོང་འདེད་པ་ཁག་ཅིག་ཡོང་གི་ཡོད་པ་འདྲ། ཁོ་ཚོ་བསྒུགས་ནས་དེ་ཚོ་ག་བར་འགྲོ་གི་ཡོད་མེད་སྐད་ཆ་དྲིས་ན་མི་དགའ་འམ་ཞེས་བཤད་དེ་ ,g.yer kha'i sgra lhang lhang zhig thos/_zla ba lags nas bong 'ded pa khag cig yong gi yod pa 'dra/_kho tsho bsgugs nas de tsho ga bar 'gro gi yod med skad cha dris na mi dga' 'am zhes bshad de _,https://d38pmlk0v88drf.cloudfront.net/wav16k/STT_AB00304_0034_280034_to_290661.wav,STT_AB,3,156,10.627,wav16k/STT_AB00304_0034_280034_to_290661.wav,དབྱར་ཁའི་སྒྲ་ལྷང་ལྷང་ཞིག་ཐོས། ཟླ་བ་ལགས་ནས་བོང་འདེབ་པ་ཁག་ཅིག་ཡོང་གི་ཡོད་པ་འདྲ། ཁོ་ཚོ་བསྒུགས་ནས་དེ་ཚོ་ག་བར་འགྲོ་གི་ཡོད་མེད་སྐད་ཆ་དྲིས་ན་མི་དགའ་འམ་ཞེས་བཤད་དེ་
STT_NS_M0509_0024_121134_to_125895,འདི་གཅིག་པོ་མ་རེད་རཱ། ད་ང་ཚོ་ད་ལྟ་འདི་ཡོད་རཱ། ང་ཚོ་གི་ག་རེ་ལབ་དགོས་རེད།  ,'di gcig po ma red rA/_da nga tsho da lta 'di yod rA/_nga tsho gi ga re lab dgos red/__,https://d38pmlk0v88drf.cloudfront.net/wav16k/STT_NS_M0509_0024_121134_to_125895.wav,STT_NS,3,73,4.761,wav16k/STT_NS_M0509_0024_121134_to_125895.wav,འདི་གཅིག་པོ་མ་རེད་རཱ། ད་ང་ཚོ་ད་ལྟ་འདི་ཡོད་རཱ་ང་ཚོ་གི་ག་རེ་ལབ་དགོས་རེད།
STT_PC0165_0141_917617_to_920945,ཨ་དེ་ནས་དེའི་སྒང་ལ་སྐྱེས་པ་དེ་ལ་ཡང་བདེ་བ་འཕྲོད་ཐུབ་ཀི་མ་རེད། བདེ་བ་མ་འཕྲོད་དུས་ཁྱེད་རང་གཉིས་ཀ་གི་ ,a de nas de'i sgang la skyes pa de la yang bde ba 'phrod thub ki ma red/_bde ba ma 'phrod dus khyed rang gnyis ka gi _,https://d38pmlk0v88drf.cloudfront.net/wav16k/STT_PC0165_0141_917617_to_920945.wav,STT_PC,3,98,3.328,wav16k/STT_PC0165_0141_917617_to_920945.wav,ཨ་དེ་ནས་དེའི་སྒང་ལ་སྐྱེས་པ་དེ་ལ་ཡང་བདེ་བ་འཕྲོད་ཐུབ་ཀི་མ་རེད། བདེ་བ་མ་འཕྲོད་དུས་ཁྱེད་རང་གཉིས་ཀ་གིས་
STT_AB00304_0036_301544_to_310344,ཟླ་བ་ལགས་ཀིས་བོང་འདེད་པ་དེ་དག་ག་ནས་ཡིན་པ་དང་། གང་དུ་འགྲོ་བ་སོགས་སྐད་ཆ་དྲིས་པས་དེ་དག་ནི་རྒྱལ་རྩེ་ནས་ཡིན་པ་དང་ཕར་ལམ་སྣ་དཀར་རྩེ་ ,zla ba lags kis bong 'ded pa de dag ga nas yin pa dang /_gang du 'gro ba sogs skad cha dris pas de dag ni rgyal rtse nas yin pa dang phar lam sna dkar rtse _,https://d38pmlk0v88drf.cloudfront.net/wav16k/STT_AB00304_0036_301544_to_310344.wav,STT_AB,3,126,8.8,wav16k/STT_AB00304_0036_301544_to_310344.wav,ཟླ་བ་ལགས་ཀྱིས་བོང་འདེབ་པ་དེ་དག་ག་ནས་ཡིན་པ་དང་། གང་དུ་འགྲོ་བ་སོགས་སྐད་ཆ་དྲིས་པས་དེ་དག་ནི་རྒྱལ་རྩེ་ནས་ཡིན་པ་དང་ཕར་ལམ་སྣ་དཀར་རྩིགས་རྒྱུ་
STT_AB00306_0095_925315_to_936066,རྟ་ལྕག་བཞུས་ཚར་བའི་རྗེས་བསྟན་པ་འབྲུ་ཁང་ཞིག་ཏུ་བཅུག ཁོས་ནང་ནས་བསྐྱལ་བའི་མར་ཟན་སོགས་བཟས་ཏེ་ཉལ། སྐབས་དེར་བསྟན་པའི་སེམས་སུ་རྟ་ལྕག་མ་བཞུས་གོང་རྫོང་གི་ལས་དྲུང་དེས་ ,rta lcag bzhus tshar ba'i rjes bstan pa 'bru khang zhig tu bcug_khos nang nas bskyal ba'i mar zan sogs bzas te nyal/_skabs der bstan pa'i sems su rta lcag ma bzhus gong rdzong gi las drung des _,https://d38pmlk0v88drf.cloudfront.net/wav16k/STT_AB00306_0095_925315_to_936066.wav,STT_AB,3,158,10.751,wav16k/STT_AB00306_0095_925315_to_936066.wav,རྟ་ལྕག་གཞུས་ཚར་བའི་རྗེས་བསྟན་པ་འྒྲུ་ཁང་ཞིག་ཏུ་བཅུག ཁོས་ནང་ནས་བསྐྱལ་པའི་མར་གཟན་སོགས་ཟས་ཏེ་ཉལ། སྐབས་དེར་བསྟན་པའི་སེམས་སུ་རྟ་ལྕག་མ་བཞུས་གོང་རྫོང་གི་ལས་དྲུང་དེས་
STT_AB00309_0135_1349795_to_1360895,གཞན་དེས། ད་ཁྱེད་རས་ཉོ་ཆ་གཟེད་འདོད་མི་འདུག་ན་ཁྱོད་རང་སོ་སོའི་འགྲོ་སར་རྒྱུགས་ཤིག གཟིག་ཚང་སྒོ་འགྲམ་ལ་གླང་རྒན་འཕག་འཚག་བརྒྱབ་ནས་ག་རེ་བྱེད་ག་ཅེས་བཤད་པས། བསྟན་པས་གཟིག་ཚང་དང་ཁྱི་ཚང་ག་རེ་ཡིན་མིན་སུས་ ,gzhan des/_da khyed ras nyo cha gzed 'dod mi 'dug na khyod rang so so'i 'gro sar rgyugs shig_gzig tshang sgo 'gram la glang rgan 'phag 'tshag brgyab nas ga re byed ga ces bshad pas/_bstan pas gzig tshang dang khyi tshang ga re yin min sus _,https://d38pmlk0v88drf.cloudfront.net/wav16k/STT_AB00309_0135_1349795_to_1360895.wav,STT_AB,3,191,11.1,wav16k/STT_AB00309_0135_1349795_to_1360895.wav,གཞན་དེས་ད་ཁྱེད་རས་ཉོ་ཆ་བཟེད་འདོད་མི་འདུག་ན་ཁྱེད་རང་སོ་སོའི་འགྲོ་སར་རྒྱུགས་ཤིག གཟིག་ཚང་སྒོ་འགྲམ་ལ་གླ་རྒལ་ཕག་ཚག་བརྒྱབ་ནས་ག་རེ་བྱེད་ཀ་ཅེས་བཤད་པས་བསྟན་པས་གཟིག་ཚང་དང་ཁྱི་ཚང་ག་རེ་ཡིན་མིན་སུ་
STT_AB00304_0038_319143_to_327943,བར་ཆང་རིན་གནང་རོགས་ཞེས་དངུལ་སྲང་ལྔ་བཅུ་ཐམ་པ་སྤྲད། ཁོང་ཚོས་ཀྱང་སྣང་དག་མི་དགོས་ཞེས་ཁས་བླངས་ཤིང་བསྟན་པའི་རྡོག་ཁྲེས་ཀྱང་བོང་བུའི་སྟེང་རྩར་བརྒྱབས།  ,bar chang rin gnang rogs zhes dngul srang lnga bcu tham pa sprad/_khong tshos kyang snang dag mi dgos zhes khas blangs shing bstan pa'i rdog khres kyang bong bu'i steng rtsar brgyabs/__,https://d38pmlk0v88drf.cloudfront.net/wav16k/STT_AB00304_0038_319143_to_327943.wav,STT_AB,3,143,8.8,wav16k/STT_AB00304_0038_319143_to_327943.wav,བར་ཆག་རིན་གནང་རོགས་ཞེས་ དངུལ་སྲང་ལྔ་བཅུ་ཐམ་པ་སྤྲད། ཁོ་ཚོས་ཀྱང་སྣང་དག་མི་དགོས་ཞེས་ཁས་བླངས་ཤིང་བསྟན་པའི་རྡོག་ཁྲེས་ཀྱང་བོང་བུའི་སྟེང་རྩགས་བརྒྱབ།
STT_MV0232_0179_1194654_to_1201488,ཚུར་ཞྭ་མོ་གཡོག་རྒྱུ་ཞོག་ཅིག ངས་རང་ལ་འདྲི་དགོས། ཅེ་ཞང་ལ་བུ་གུ་འཁོར་བ་རེད་ཟེར་ཡ་དེ་དངོས་གནས་རེད་རྫུན་མ་རེད། རྒྱུགས།  ,tshur zhwa mo g.yog rgyu zhog cig_ngas rang la 'dri dgos/_ce zhang la bu gu 'khor ba red zer ya de dngos gnas red rdzun ma red/_rgyugs/__,https://d38pmlk0v88drf.cloudfront.net/wav16k/STT_MV0232_0179_1194654_to_1201488.wav,STT_MV,3,115,6.834,wav16k/STT_MV0232_0179_1194654_to_1201488.wav,ཚུར་ཞྭ་མོ་གཡོར་རྒྱུ་ཞོར་ཞིག ངས་རང་འདྲི་དགོས། ཅེ་ཞང་ལ་པུ་གུ་འཁོར་བ་རེད་ཟེར་ཡ་དེ་དངོས་གནས་རེད་རྫུན་མ་རེད། རྒྱུགས།
STT_CS-D-2013-M-D-B06-4-R-05_0019_127412_to_132770,སྙིང་རྗེ་བོ་འདུག་ལབ་ཡིན་ད་རཱ། ང་ང་རང་ཆེད་དུ་ད། སོ་སོ་ཆེད་དུ་ཇོཀཱ་ཚ་བོ་ཡོད་ནའི། ང་རང་ཆེད་དུ་ད། ཏོག་ཙི་ཅིག་ང་།  ,snying rje bo 'dug lab yin da rA/_nga nga rang ched du da/_so so ched du jokA tsha bo yod na'i/_nga rang ched du da/_tog tsi cig nga /__,https://d38pmlk0v88drf.cloudfront.net/wav16k/STT_CS-D-2013-M-D-B06-4-R-05_0019_127412_to_132770.wav,STT_CS,3,110,5.358,wav16k/STT_CS-D-2013-M-D-B06-4-R-05_0019_127412_to_132770.wav,སྙིང་རྗེ་བོ་འདུག་ལབ་ཡིན་ད་རཱ། ང་ང་རང་ཆུས་ཚོད་ད་སྐད་ཆོ་བཤད་འདུག་ཇཱོ་ཚ་བོ་ཡོད་ར། ང་ག་རེ་བྱས་ནས་ལབ་ན། ཏིས་ཙི་ཅིག་ང་།
STT_PC0165_0172_1100147_to_1103123,ལུས་འབྲེལ་གི་འདོད་པ་མ་ཚིམ་ན། བཟའ་ཚང་གི་མཐུན་ལམ་ལ་འཐོར་འགྲོ་གི་རེད་ཟེར་ཡ་དེའི་སྐོར།  ,lus 'brel gi 'dod pa ma tshim na/_bza' tshang gi mthun lam la 'thor 'gro gi red zer ya de'i skor/__,https://d38pmlk0v88drf.cloudfront.net/wav16k/STT_PC0165_0172_1100147_to_1103123.wav,STT_PC,3,84,2.976,wav16k/STT_PC0165_0172_1100147_to_1103123.wav,ལུས་འབྲེལ་གི་འདོད་པ་མ་འཚུམས་ན། བཟའ་ཚང་གི་མཐུན་ལམ་ལ་འཐོ་འགྲོ་གི་རེད་ཟེར་ཡ་དེའི་སྐོར།
STT_NS_M0518_0257_3519343_to_3521527,པེ་ཤག་ད་འདི་ལས་ཡག་ག་འབྱོར་ཡ་ཅིག་དང་ད།  ,pe shag da 'di las yag ga 'byor ya cig dang da/__,https://d38pmlk0v88drf.cloudfront.net/wav16k/STT_NS_M0518_0257_3519343_to_3521527.wav,STT_NS,3,39,2.184,wav16k/STT_NS_M0518_0257_3519343_to_3521527.wav,པེ་ཤག་ད་འདི་ལས་ཡག་ག་འབྱོར་ཡ་ཅིག་དང་ད།
STT_NS_M0456_0296_2673579_to_2675657,ང་ཚོ་གསུམ་མ་ཤས། མ་ཤས་ནས་གཞན་པ་ཚང་མ་རཱ། ང་ཚོ།  ,nga tsho gsum ma shas/_ma shas nas gzhan pa tshang ma rA/_nga tsho/__,https://d38pmlk0v88drf.cloudfront.net/wav16k/STT_NS_M0456_0296_2673579_to_2675657.wav,STT_NS,3,46,2.078,wav16k/STT_NS_M0456_0296_2673579_to_2675657.wav,ང་ཚོ་གསུམ་མ་ཤས་མ་གཞི་ནས་གཞན་པ་ཚང་མ་ནང་ལ་ང་ཚོ།
STT_NS_M0451_0019_158658_to_163860,ཨོ། ཨོ་འདི་གཡོག་པོ་འདི་ཏིས་ཙི་ཡུན་རིང་པོ་འདྲ་བོ་བསྡད་མ་རེད། ང་ཚོ་དེའི་སྔོན་ནས་ཡོད་བ་ཁོ་ཚོ་སྨན་རྩིས་ཁང་ཀ་ཅི་ཟ་ཁང་སྐབས་ནས་ཡོད་རཱ་དེ་གཡོག་ ,o/_o 'di g.yog po 'di tis tsi yun ring po 'dra bo bsdad ma red/_nga tsho de'i sngon nas yod ba kho tsho sman rtsis khang ka ci za khang skabs nas yod rA de g.yog _,https://d38pmlk0v88drf.cloudfront.net/wav16k/STT_NS_M0451_0019_158658_to_163860.wav,STT_NS,3,136,5.202,wav16k/STT_NS_M0451_0019_158658_to_163860.wav,ཨོཨོ་དེ་གཡོག་པོ་ཏིས་ཙི་ཡུན་རིང་པོ་འདྲ་བོ་བསྡད་མ་རེད། ང་ཚོ་འདིའི་སྔོན་ནས་ཡོད་བ། ཁོ་ཚོ་སྨན་རྩིས་ཁང་ཀ་ཅི་ཟ་ཁང་སྒབས་ནས་ཡོད་རཱ་འདི་གཡོག་པ།
STT_NS_M0509_0027_140366_to_143548,ད་སློབ་སྦྱོང་འདི་ད་ང་ཚོ་སྦྱང་ཡ་གི་ལས་འགན་ཅིག་ཆགས་བསྡད་ཡོད་རེད། ཨེ་ནས།  ,da slob sbyong 'di da nga tsho sbyang ya gi las 'gan cig chags bsdad yod red/_e nas/__,https://d38pmlk0v88drf.cloudfront.net/wav16k/STT_NS_M0509_0027_140366_to_143548.wav,STT_NS,3,71,3.182,wav16k/STT_NS_M0509_0027_140366_to_143548.wav,ད་སློབ་སྦྱོང་འདི་ད་ང་ཚོ་སྦྱང་ཡ་གི་ལས་འགན་ཅིག་ཆགས་བསྡད་ཡོད་རེད་ཨེ་ནས།
STT_PC0147_0271_2036988_to_2045486,ཅིག་འདོད་པ་ཁེངས་དང་ཁེངས་དང་། ཐུགས་ཕམ་ཡོང་གི་ཡོད་མེད་ཀི་གནས་སྟངས་དེ་ཚོ་ད་ང་ཚོའི་སྤྱི་ཚོགས་ནང་ལོགས་ལ་ཡ་གསལ་པོ་རེད། ངའི་སྐབས་ལ་ཡ་དེ་འདྲའི་རྩ་བ་ཉིད་ནས་ཡོང་གི་མ་རེད་ཟེ་བྱས་ནས་ཞུ་གི་ཡོད།  ,cig 'dod pa khengs dang khengs dang /_thugs pham yong gi yod med ki gnas stangs de tsho da nga tsho'i spyi tshogs nang logs la ya gsal po red/_nga'i skabs la ya de 'dra'i rtsa ba nyid nas yong gi ma red ze byas nas zhu gi yod/__,https://d38pmlk0v88drf.cloudfront.net/wav16k/STT_PC0147_0271_2036988_to_2045486.wav,STT_PC,3,182,8.498,wav16k/STT_PC0147_0271_2036988_to_2045486.wav,ཅིག་འདོད་པ་ཁེངས་དམའ་ཁེངས་དང་། ཐུགས་ཕམ་ཡོང་གི་ཡོད་མེད་ཀི་གནས་སྟངས་དེ་ཚོ། ད་ང་ཚོའི་སྤྱི་ཚོགས་ནང་ལོགས་ལ་ཡ་གསལ་པོ་རེད། ངའི་སྐབས་ལ་ཡ་དེ་འདྲའི་རྩ་བ་ཉིད་ནས་ཡོང་གི་མ་རེད་ཟེ་བྱས་ནས་ཞུ་གི་ཡོད།
STT_NS_M0514_0071_501161_to_503959,ཨོ་ཨེ་འདྲའི་ཡིན་དུས་ཙམ་པ་ལ་ཡོད་བ། ད་སོ་སོའི་ནང་མིས་དེ་འདྲའི་འདྲ་བོ་བྱེད་ཀི་ཡོད་མ་རཱ།  ,o e 'dra'i yin dus tsam pa la yod ba/_da so so'i nang mis de 'dra'i 'dra bo byed ki yod ma rA/__,https://d38pmlk0v88drf.cloudfront.net/wav16k/STT_NS_M0514_0071_501161_to_503959.wav,STT_NS,3,86,2.798,wav16k/STT_NS_M0514_0071_501161_to_503959.wav,ཨོ་ཨེ་འདྲའི་ཡིན་དུས་ཙམ་པ་ལ་ཡོད་བ། ད་སོ་སོའི་ནང་མིས་དེ་འདྲའི་འདྲ་བོ་བྱེད་ི་གོ་མ་རཱ།
STT_MV0232_0180_1201488_to_1209191,རྒྱུགས་ཟེར་ན་ངས་ཕྱིན་ཆོག རྨོ་ལགས། རྨོ་ལགས། ཁྱེད་རང་གིས་དྲང་པོ་གསུངས་ད། ངེད་གཉིས་མཉམ་དུ་ཁྲང་ཞི་ལྟ་ག་ཕྱིན་པ་ཡིན།  ,rgyugs zer na ngas phyin chog_rmo lags/_rmo lags/_khyed rang gis drang po gsungs da/_nged gnyis mnyam du khrang zhi lta ga phyin pa yin/__,https://d38pmlk0v88drf.cloudfront.net/wav16k/STT_MV0232_0180_1201488_to_1209191.wav,STT_MV,3,112,7.703,wav16k/STT_MV0232_0180_1201488_to_1209191.wav,རྒྱུགས་ཟེ། ངས་ཕྱིན་ཆོག རྨོོ་ལགས། རྨོ་ལགས་ཁྱེད་རང་གིས་དྲང་པོ་གསུངས་ད། ངེད་གཉིས་མཉམ་དུ་ཁྲང་ཤི་འྟག་ག་ཕྱིན་པ་ཡིན།
STT_PC0165_0175_1125912_to_1128250,ཡང་ན་ཅིག་སེམས་ཁྲལ་སླེབས་པའི་བཟོ་འདྲ་བོ།  ,yang na cig sems khral slebs pa'i bzo 'dra bo/__,https://d38pmlk0v88drf.cloudfront.net/wav16k/STT_PC0165_0175_1125912_to_1128250.wav,STT_PC,3,41,2.338,wav16k/STT_PC0165_0175_1125912_to_1128250.wav,ཡང་ན་ཅིག་སེམས་ཁྲལ་སླེབས་པའི་ཟོལ་འདྲ་བོ།
STT_AB00309_0136_1360895_to_1371996,སུས་ཤེས། ཁྱོད་རང་ཚོ་སྡུག་ཚོད་ཟིན་ན་ཟིན་ཅིག སྡུག་ཚོད་མ་ཟིན་པ་ཡིན་ན་ཉོ་ཆ་གཟེད་ཡོང་ང་། ཞེས་བཤད་པས་ཁོ་རབ་ཏུ་ཁྲོས་ནས་བསྟན་པའི་མདུན་དུ་ལྷགས་ཏེ་གཞུ་བར་བརྩམས། ཁོས་ལག་པ་ཡར་འགྱོགས་རྩིས་བྱས་མ་ ,sus shes/_khyod rang tsho sdug tshod zin na zin cig_sdug tshod ma zin pa yin na nyo cha gzed yong nga /_zhes bshad pas kho rab tu khros nas bstan pa'i mdun du lhags te gzhu bar brtsams/_khos lag pa yar 'gyogs rtsis byas ma _,https://d38pmlk0v88drf.cloudfront.net/wav16k/STT_AB00309_0136_1360895_to_1371996.wav,STT_AB,3,182,11.101,wav16k/STT_AB00309_0136_1360895_to_1371996.wav,ཚོད་ཞིན། ཁྱེད་རང་ཚོ་སདུག་ཚོད་ཟིན་ན་ཟིམ་ཅིག སདུག་ཚོད་མ་ཟིན་པ་ཡིན་ན་ཉོ་ཆ་བཟེད་ཡོང་ང་ཞེས་བཤད་པས་ཁོ་རབ་ཏུ་བྲོས་ནས་བསྟན་པའི་མདུན་དུ་ལྷགས་ཏེ་ཞུ་བར་བརྩམས། ཁོས་ལག་པ་ཡར་མྒྱོག་རྩིས་བྱས་མ་
STT_NS_M0455_0138_999998_to_1005606,ཨོ་དེའི་སྐབས་ལ་ང་ཡོད་བ། པེ་ཤ་ལབ་ཡ་དེ་ཨེ་འདྲའི་བསམ་གྱི་མི་འདུག ང་པེ་བསམ་གྱི་མི་འདུག པཱ་ལགས་ཨ་མ་ལབ་ན་པ་ཤ་ཡོད་ཀྱི་རེད་དྲན་ཡ་དེ་མེད་བེ། ཁོ་ཚོ།  ,o de'i skabs la nga yod ba/_pe sha lab ya de e 'dra'i bsam gyi mi 'dug_nga pe bsam gyi mi 'dug_pA lags a ma lab na pa sha yod kyi red dran ya de med be/_kho tsho/__,https://d38pmlk0v88drf.cloudfront.net/wav16k/STT_NS_M0455_0138_999998_to_1005606.wav,STT_NS,3,140,5.608,wav16k/STT_NS_M0455_0138_999998_to_1005606.wav,གོ་དུས་སྐབས་ལ་ང་ཡོད་བ་པེ་ཤག་ལབ་ནས་ཨེ་འདྲའི་བསམ་གྱི་མི་འདུག་བ ང་ེ་བསམ་གི་མི་འདུག ་ལ་ཨ་མ་ལབ་ན་པེ་ཤ་པེ་ཤ་་དྲན་ཡ་ཅིག་མེད་བ་ཁོ་ཚོ།
STT_MV0937_0110_1056809_to_1065123,སོ་སོའི་བྱ་གཞག་བརྟེན་རྒྱུ་དང་། ཨ་མ་ལགས་ཀི་གདོང་ཆུ་ལ་མ་གཡུགས་པ་བྱེད་དགོས་རེད། ད་ག་རེད། ག་རེའི་དགའ་བོའི་མི་ཚང་།  ,so so'i bya gzhag brten rgyu dang /_a ma lags ki gdong chu la ma g.yugs pa byed dgos red/_da ga red/_ga re'i dga' bo'i mi tshang /__,https://d38pmlk0v88drf.cloudfront.net/wav16k/STT_MV0937_0110_1056809_to_1065123.wav,STT_MV,3,111,8.314,wav16k/STT_MV0937_0110_1056809_to_1065123.wav,སོ་སོར་བྱ་གཞག་བསྟན་རྒྱུ་དང་ཨ་མ་ལགས་ཀི་གདོང་ཆུ་ལ་མ་གཡུག་པ་བྱེད་དགོས་རེད། ད་ག་རེད། ག་རེའི་འགག་པོའི་མི་ཚང་།
