file_name,uni,wylie,url,dept,grade,char_len,audio_len,path,inf
STT_AB00305_0054_550238_to_557943,ཆེན་པོ་བྱས་པ་དེར་ཁྱི་སྐྱག་གི་སེམས་ལ་མི་འདོད་པའི་ཕྲག་དོག་ལངས་ནས་མི་དགའ་བ་བྱས་ཏེ་བསྟན་པར་མི་འདོད་པའི་རྣམ་འགྱུར་ཡང་ཡང་སྟོན་གི་ཡོད།  ,chen po byas pa der khyi skyag gi sems la mi 'dod pa'i phrag dog langs nas mi dga' ba byas te bstan par mi 'dod pa'i rnam 'gyur yang yang ston gi yod/__,https://d38pmlk0v88drf.cloudfront.net/wav16k/STT_AB00305_0054_550238_to_557943.wav,STT_AB,3,129,7.705,wav16k/STT_AB00305_0054_550238_to_557943.wav,ཆེན་པོ་བྱས་པ་དེར་ཁྱི་སྐྱག་གི་སེམས་ལ་མི་འདོད་པའི་ཕྲག་དོག་ལངས་ནི་མི་དགའ་བ་བྱས་ཏེ་བསྟན་པར་མི་འདོད་པའི་རྣམ་འགྱུར་ཡང་ཡང་སྟོན་གྱི་ཡོད།
STT_AB00305_0058_593250_to_604820,ནམ་སྨད་ལ་གཅིག་སྟེ་ཐེངས་གཉིས་རེ་སྟེར་དགོས་ཀི་ཡོད་ཀྱང་། སྐབས་རེ་མཚན་མོ་ཕྱི་ལ་ཤོ་སྦག་སོགས་རྒྱག་པར་ཕྱིན་ནས་མཚན་ལྟོ་རྒྱག་མཁན་མེད་པ་དང་། སྐབས་རེ་ནི་ནང་དུ་བསྡད་ཡོད་ཀྱང་མཚན་མོ་ལངས་མ་སྒྱིད་པར་སེམས་ཅན་དེ་ཚོར་ ,nam smad la gcig ste thengs gnyis re ster dgos ki yod kyang /_skabs re mtshan mo phyi la sho sbag sogs rgyag par phyin nas mtshan lto rgyag mkhan med pa dang /_skabs re ni nang du bsdad yod kyang mtshan mo langs ma sgyid par sems can de tshor _,https://d38pmlk0v88drf.cloudfront.net/wav16k/STT_AB00305_0058_593250_to_604820.wav,STT_AB,3,199,11.57,wav16k/STT_AB00305_0058_593250_to_604820.wav,ན་མད་ལ་གཅིག་སྟེ་ཐེངས་གཉིས་རེ་སྟེར་དགོས་ཀི་ཡོད་ཀྱང་། སྐབས་རེ་མཚན་མོ་ཕྱི་ལ་ཤོ་སྦག་སོགས་རྒྱག་པར་ཕྱིན་ནས་མཚན་ལཐོ་རྒྱག་མཁན་མེད་པ་དང་། སྐབས་རེ་ནི་ནང་དུ་བསྡད་ཡོད་ཀྱང་མཚན་མོ་ལངས་མ་རྒྱིས་པར་སེམས་ཅན་འདེ་ཚོ་
STT_AB00305_0059_604820_to_616390,ཚོར་མཚན་ལྟོ་ཐེངས་གཅིག་ཀྱང་སྟེར་མཁན་མེད་པར་ལུས་ཀི་ཡོད་རེད། ཁོ་ནི་རང་གི་བྱེད་དགོས་པའི་ལས་ཀ་ཡང་གཞན་ལ་སྐུལ་གང་ཐུབ་བྱེད་ཀི་ཡོད་ཙང་དེ་སྔོན་གི་ལས་ཀ་རྟ་བོང་དང་། བ་མཛོ་བཅས་ལ་མཚན་ལྟོ་སྟེར་རྒྱུ་དེ་ ,tshor mtshan lto thengs gcig kyang ster mkhan med par lus ki yod red/_kho ni rang gi byed dgos pa'i las ka yang gzhan la skul gang thub byed ki yod tsang de sngon gi las ka rta bong dang /_ba mdzo bcas la mtshan lto ster rgyu de _,https://d38pmlk0v88drf.cloudfront.net/wav16k/STT_AB00305_0059_604820_to_616390.wav,STT_AB,3,187,11.57,wav16k/STT_AB00305_0059_604820_to_616390.wav,མཚན་ལཐོ་ཐེངས་གཅིག་ཀྱང་སྟེར་མཁན་མེད་པར་ལོད་ཀི་ཡོད་རེད། ཁོ་ནི་རང་གིས་བྱེད་དགོས་པའི་ལས་ཀ་ཡང་གཞན་ལ་སྐུལ་གང་ཐུབ་བྱེད་ཀྱི་ཡོད་ཙང་དེ་སྔོན་གྱི་ལས་ཀ་རྟ་བོང་དང་བ་ཚོ་བཅས་ལ་མཚན་ལྟོ་སྟེར་རྒྱུ་དེ་
STT_PC0165_0240_1564087_to_1566359,ཨ། ལོངས་སྤྱོད་བྱེད་དགོས་ཡ་དང་བྱེད་བཏང་ཤེས་དགོས་ཡ་ཁ་ཤས་ཤེས་དགོས་ཀིས།  ,a/_longs spyod byed dgos ya dang byed btang shes dgos ya kha shas shes dgos kis/__,https://d38pmlk0v88drf.cloudfront.net/wav16k/STT_PC0165_0240_1564087_to_1566359.wav,STT_PC,3,69,2.272,wav16k/STT_PC0165_0240_1564087_to_1566359.wav,ཨ་ལོངས་སྤྱོད་བྱེད་དགོས་ཡ་དང་བྱེད་སྟངས་ཤེས་དགོས་ཡ་ཁ་ཤས་ཤེས་དགོས་ཀི
STT_CS-L-2016_2015-M_M-D_D-B05_B02-2_2-R_R-01_0017_8_to_8480,བཤད། བཤད་སོང་ང། གཡང་ལག། རྒན་ལགས་པེ་ཤ་ཡོད། སྐར་མ་གཅིག་ཟིམ་དང་། པེ་ཤ་ལེན་དང་། ཨོ་དེ་ཨེ་འདྲའི་འདྲ་བོ། ཨེ་འདྲའི་ག་རེ་མགོ།  ,bshad/_bshad song nga/_g.yang lag/_rgan lags pe sha yod/_skar ma gcig zim dang /_pe sha len dang /_o de e 'dra'i 'dra bo/_e 'dra'i ga re mgo/__,https://d38pmlk0v88drf.cloudfront.net/wav16k/STT_CS-L-2016_2015-M_M-D_D-B05_B02-2_2-R_R-01_0017_8_to_8480.wav,STT_CS,3,119,8.472,wav16k/STT_CS-L-2016_2015-M_M-D_D-B05_B02-2_2-R_R-01_0017_8_to_8480.wav,བཤད་སོང་ང་། གཡག་ལགས། སློང་ག་པེ་ཤ་ཅི་ཁིམ་ཚང། ་་། ཨོ་དེ་ཨེ་འདྲའི་་། ཨེ་འདྲའིང་་ག་རེ་མགོ།
STT_AB00305_0061_629155_to_638063,ཁྱི་སྐྱག་ཕྱི་ལ་འགྲོ་རིམ་བཞིན་བསྟན་པས་སྒོ་ཕྱུགས་ལ་མཚན་ལྟོ་ཐེངས་གཉིས་རེ་དུས་ཐོག་ཏུ་སྟེར་བར་བརྟེན། སེམས་ཅན་དེ་ཚོ་ཡང་ཤ་ཤེད་སྔར་ལས་ཇེ་བཟང་དུ་ཕྱིན་ཡོད།  ,khyi skyag phyi la 'gro rim bzhin bstan pas sgo phyugs la mtshan lto thengs gnyis re dus thog tu ster bar brten/_sems can de tsho yang sha shed sngar las je bzang du phyin yod/__,https://d38pmlk0v88drf.cloudfront.net/wav16k/STT_AB00305_0061_629155_to_638063.wav,STT_AB,3,147,8.908,wav16k/STT_AB00305_0061_629155_to_638063.wav,ི་སྐྱ་ཕྱི་ལོ་འབྲུ་རིམ་བཞིན་བསྟན་པས་སྒོ་ཕྱུགས་ལ་མཚན་ལཐོ་ཐེངས་གཉིས་རེ་དུས་ཐོག་ཏུ་སྟེར་བར་བརྟེན་སེམས་ཅན་དེ་ཚོ་ཡང་ཤར་ཞིང་སྔར་ལས་ཇེ་བཟང་དུ་ཕྱིན་ཡོད།
STT_NS_M0484_0258_1772143_to_1774639,འབྲས་བྱས་ཨེ་ནས་ཟུར་ལ་ཚལ་གཅིག་གཉིས་ད།  ,'bras byas e nas zur la tshal gcig gnyis da/__,https://d38pmlk0v88drf.cloudfront.net/wav16k/STT_NS_M0484_0258_1772143_to_1774639.wav,STT_NS,3,38,2.496,wav16k/STT_NS_M0484_0258_1772143_to_1774639.wav,འབྲས་བྱས་ཨེ་ནས་ཟུར་ལ་ཚལ་གཅིག་གཉིས་ད།
STT_AB00305_0066_677551_to_684129,ཨ་ལེ། ད་བྱེད་དུས་ཆོས་མཛད་རང་སེམས་ཅན་ལ་ཡ་མཚན་ལྟོ་རྒྱག་རྒྱུ་དེ་ཁག་པོ་བྱུང་བ་འདྲ། དོ་དགོང་རིང་ལ་ཡ་མཚན་ལྟོ་རྒྱག་རོགས།  ,a le/_da byed dus chos mdzad rang sems can la ya mtshan lto rgyag rgyu de khag po byung ba 'dra/_do dgong ring la ya mtshan lto rgyag rogs/__,https://d38pmlk0v88drf.cloudfront.net/wav16k/STT_AB00305_0066_677551_to_684129.wav,STT_AB,3,115,6.578,wav16k/STT_AB00305_0066_677551_to_684129.wav,ཨ་ལས། ད་བྱེད་དུས་ཆོས་མཛད་རང་སེམས་ཅན་ལ་ཡ་མཚན་ལྟོ་རྒྱག་རྒྱུ་དེ་ཁག་པོ་བྱུང་པ་འདྲ། དོ་དགོང་རིང་ལ་ཡ་མཚན་ལྟོ་རྒྱག་རོགས།
STT_MV0752_0163_1256268_to_1266180,རང་གིས། མུ་མཐུད་བྱས་ཁྲོམ་རའི་རིན་ཐང་ཡོད་པའི། རྩོམ་རིག་ཞུ་བསྡུར་བྱེད། རྩོམ་རིག་རང་བཞིན་དང་། དཔལ་འབྱོར་ཁེ་འབབ་ཡོད་པ་གཉིས། ཟུང་སྦྲེལ་བྱེད་དགོས་རེད། ཡོང་ང་འདུག་གེ་ཨཱ།  ,rang gis/_mu mthud byas khrom ra'i rin thang yod pa'i/_rtsom rig zhu bsdur byed/_rtsom rig rang bzhin dang /_dpal 'byor khe 'bab yod pa gnyis/_zung sbrel byed dgos red/_yong nga 'dug ge A/__,https://d38pmlk0v88drf.cloudfront.net/wav16k/STT_MV0752_0163_1256268_to_1266180.wav,STT_MV,3,164,9.912,wav16k/STT_MV0752_0163_1256268_to_1266180.wav,རང་གིས་མུ་མཐུད་བྱས་ཁྲོམ་རྭའི་རིན་ཐང་ཡོད་པའི་རྩོམ་རིག་ཞུ་གཏོད་གྱིས། རྩོམ་རིག་གི་རང་བཞིན་དང་དཔལ་འབྱོར་ཁེ་ཕོགས་ཡོད་པ་གཉིས་ཟུང་སྒྲིལ་བྱེད་དགོས་རེད། ཡོང་ང་འདུག་གེ་ཨ།
STT_AB00305_0070_706237_to_717659,སྐབས་དེར་བསྟན་པའི་སེམས་སུ་བཟང་བྱས་ངན་དུ་གོ་བ་འདི་གང་དྲགས། རྟ་རྒན་སྒལ་བཅོས་བྱས་པ་ངན་དུ་གོ། ཕག་པ་དོམ་གསོས་བརྒྱབ་པ་བཟང་དུ་གོ། ཟེར་བ་བདེན་པ་རང་རེད་ཤག་བསམས་ནས་ཅི་ཤོད་འདི་ཤོད་མེད་པར་ ,skabs der bstan pa'i sems su bzang byas ngan du go ba 'di gang drags/_rta rgan sgal bcos byas pa ngan du go/_phag pa dom gsos brgyab pa bzang du go/_zer ba bden pa rang red shag bsams nas ci shod 'di shod med par _,https://d38pmlk0v88drf.cloudfront.net/wav16k/STT_AB00305_0070_706237_to_717659.wav,STT_AB,3,177,11.422,wav16k/STT_AB00305_0070_706237_to_717659.wav,སྐབས་དེར་བསྟན་པའི་སེམས་སུ་བཟང་ྱས་ངན་དུ་འགོར་བ་འདི་གང་འདྲག རྟ་རྒན་རྒས་བཅོས་བྱས་པ་ངན་དུ་དགོ། ཕགས་པ་དོམ་གཟོད་བརྒྱབ་པ་བཟང་དུ་དགོས། ཟེར་བ་བདེན་པ་རང་རེད་ཤག་བསམ་ནས་ཅི་ཤོད་འདི་ཤོད་མེད་པར་
STT_AB00305_0090_926203_to_929633,བསྟན་པ་ཕར་བརྒྱུགས་ཕྱིན་ནས་ཁྱི་སྐྱག་ཡར་བསླངས་པས་ཁྱི་སྐྱག་གིས་ ,bstan pa phar brgyugs phyin nas khyi skyag yar bslangs pas khyi skyag gis _,https://d38pmlk0v88drf.cloudfront.net/wav16k/STT_AB00305_0090_926203_to_929633.wav,STT_AB,3,61,3.43,wav16k/STT_AB00305_0090_926203_to_929633.wav,བསྟན་པ་ཕར་རྒྱུགས་ཕྱིན་ནས་ཁྱི་སྐྱག་ལ་ཡར་བླངས་པས་ཁྱི་སྐྱག་གིས་
STT_AB00305_0093_943412_to_952090,ཨ་ཙི་བུ་དེ་འདྲས་མ་གསུངས་ཤིག རྟའི་གློ་དེ་འདི་ལས་དམ་པ་བྱེད་ཐབས་མི་འདུག་ག དེ་ལས་རང་གི་སྐ་རགས་ཀྱང་འཛར་བཞག་ཅེས་བཤད།  ,a tsi bu de 'dras ma gsungs shig_rta'i glo de 'di las dam pa byed thabs mi 'dug ga_de las rang gi ska rags kyang 'dzar bzhag ces bshad/__,https://d38pmlk0v88drf.cloudfront.net/wav16k/STT_AB00305_0093_943412_to_952090.wav,STT_AB,3,112,8.678,wav16k/STT_AB00305_0093_943412_to_952090.wav,ཨོ་ཙི་བུ་ དེ་འདྲས་མ་གསུངས་ཤིག རྟའི་བློ་འདི་དེ་ལས་འདམ་པ་བྱེད་ཐབས་མི་འདུག་ག དེ་ལས་རང་གི་སྐ་རགས་ཀྱང་འཛར་ཤག་ཅེས་བཤད།
STT_AB00305_0073_741220_to_752687,དེ་ནས་བཟུང་སྟེ་ཁྱི་སྐྱག་གི་ས་རུབ་ལ་ཉེ་བའི་ཚེ་ནང་དུ་སྡོད་མ་ཚུགས་པ་ལྟ་བུར་གྱུར་ཏེ་རྟག་པར་ཕྱི་ལ་ཤོ་སྦག་རྒྱག་པར་ཕྱིན་ཏེ་ཞོགས་པ་ནམ་ལངས་ལ་ཉེ་སྐབས་སུ་གཞི་ནས་ལོག་ཡོང་གི་ཡོད། ཡུན་ ,de nas bzung ste khyi skyag gi sa rub la nye ba'i tshe nang du sdod ma tshugs pa lta bur gyur te rtag par phyi la sho sbag rgyag par phyin te zhogs pa nam langs la nye skabs su gzhi nas log yong gi yod/_yun _,https://d38pmlk0v88drf.cloudfront.net/wav16k/STT_AB00305_0073_741220_to_752687.wav,STT_AB,3,171,11.467,wav16k/STT_AB00305_0073_741220_to_752687.wav,དེ་ནས་བཟུང་སྟེ་ཁྱི་སྐྱག་གི་ས་རུབ་ལ་ཉེ་བའི་ཚེ་ནང་དུ་སྡོད་མ་ཚུགས་པ་ལྟ་བུར་གྱུར་ཏེ། རྟག་པར་ཕྱི་ལ་ཤོ་སྦག་རྒྱག་པར་ཕྱིན་ཏེ་ཞོགས་པ་ནམ་ལངས་ལ་ཉེ་སྐབས་སུ་གཞི་ནས་ལོག་ཡོང་གི་ཡོད། ཡུན་རིང་
STT_PC0165_0241_1589769_to_1596009,ཨེ་ནས་ཁོ་ལུས་འབྲེལ་བྱེད་མ་ཤེས་ན་གེ་ཡོད་མ་རེད། གང་ལྟར་སྐྱེས་པ་ཅིག་རེད་ཟེར་དུས་ཙམ་པ་ལ། དགོང་ད་དེ་བ་སླེབས་ཡོང་བྱས། དེ་ནས་ཁར་ཐུག་ཉལ་ས་ནང་ལ་མར་འཛུལ། གོས་ཐུང་དེ་མར་མ་གི་ ,e nas kho lus 'brel byed ma shes na ge yod ma red/_gang ltar skyes pa cig red zer dus tsam pa la/_dgong da de ba slebs yong byas/_de nas khar thug nyal sa nang la mar 'dzul/_gos thung de mar ma gi _,https://d38pmlk0v88drf.cloudfront.net/wav16k/STT_PC0165_0241_1589769_to_1596009.wav,STT_PC,3,164,6.24,wav16k/STT_PC0165_0241_1589769_to_1596009.wav,ཨེ་ནས་ཁོ་ལུས་འབྲེལ་བྱེད་མ་ཤེས་ན་གེ་ཡོད་མ་རེད། གང་ལྟར་སྐྱེས་པ་ཅིག་རེད་ཟེར་དུས་ཙམ་པ་ལ། དགོང་དག་དེ་བ་སླེབས་ཡོང་བྱས། དེ་ནས་ཁ་ཐུག་ཉལ་ས་ནང་མར་འཛུལ། གོས་ཐུང་དེ་མར་མ་གིར་
STT_MV0752_0167_1283773_to_1290622,མ་ཟད་རྩོམ་སྒྲིག་ཁང་ཡེ་གཡང་ལ་གཡུག་གི་ཡོད་རེད། དཔེ་སྐྲུན་ཁང་འདི་འདྲས་ནང་ལས་ཀ་བྱེད་པ་ལས། ང་ལས་དགོངས་ཞུས་ན་དགའ་གི་རེད།  ,ma zad rtsom sgrig khang ye g.yang la g.yug gi yod red/_dpe skrun khang 'di 'dras nang las ka byed pa las/_nga las dgongs zhus na dga' gi red/__,https://d38pmlk0v88drf.cloudfront.net/wav16k/STT_MV0752_0167_1283773_to_1290622.wav,STT_MV,3,116,6.849,wav16k/STT_MV0752_0167_1283773_to_1290622.wav,མ་ཟད་རྩོམ་སྒྲིག་ཁང་ཡེ་གཡང་ལ་གཡུག་གི་ཡོད་རེད། དཔེ་སྐྲུན་ཁང་དེ་འདྲས་ནང་ལས་ཀ་བྱས་པ་ལས། ང་ལས་དགོངས་ཞུས་ན་དགའ་གི་རེད།
STT_AB00305_0110_1092841_to_1105418,ཞེས་དགའ་ཚོར་ཆེ་མདོག་བྱེད་པ་དང་། སངས་རྒྱས་ལགས་ནས་ཀྱང་དངོས་གནས་དེ་རིང་ཡག་པོ་ཞེ་དྲག་བྱུང་སོང་ཨ་ཞེས་བསྔགས་བརྗོད་བྱས་ཀྱང་སྐྱིད་པ་ལགས་དང་། ཁྱི་སྐྱག་གཉིས་ནི་སྣ་ཤུ་རྒྱག་བཞིན་དུ་མི་འདོད་པའི་རྣམ་འགྱུར་སྟོན་གི་ཡོད་པ་རེད།  ,zhes dga' tshor che mdog byed pa dang /_sangs rgyas lags nas kyang dngos gnas de ring yag po zhe drag byung song a zhes bsngags brjod byas kyang skyid pa lags dang /_khyi skyag gnyis ni sna shu rgyag bzhin du mi 'dod pa'i rnam 'gyur ston gi yod pa red/__,https://d38pmlk0v88drf.cloudfront.net/wav16k/STT_AB00305_0110_1092841_to_1105418.wav,STT_AB,3,211,12.577,wav16k/STT_AB00305_0110_1092841_to_1105418.wav,ཞེས་དགའ་ཚོར་ཆེ་མདོག་བྱེད་པ་དང་། སངས་རྒྱས་ལགས་ནས་ཀྱང་དངོས་གནས་དེ་རིང་ཡག་པོ་ཞེ་དྲག་བྱུང་སོང་ང་ཞེས་བསྔགས་བརྗོད་བྱས་ཀྱང་སྐྱིད་པ་ལགས་དང་ཁྱི་སྐྱག་གཉིས་ནི་སྣ་ཤུ་རྒྱག་བཞིན་དུ་མི་འདོད་པའི་རྣམ་འགྱུར་སྟོན་གྱི་ཡོད་པ་རེད།
STT_MV0723_0076_644444_to_653749,ཁོས་ཕྱི་ལ་ཟུར་མོ་བཙལ། ཆུང་མ་ཉར།  ,khos phyi la zur mo btsal/_chung ma nyar/__,https://d38pmlk0v88drf.cloudfront.net/wav16k/STT_MV0723_0076_644444_to_653749.wav,STT_MV,3,33,9.305,wav16k/STT_MV0723_0076_644444_to_653749.wav,ཁོས་ཕྱི་ལ་ཟུར་མོ་བཙལ།ཆུང་མ་ཉལ།
STT_AB00305_0079_805810_to_817738,ཤ་ཤེད་ཡག་པོ་རྒྱས་འདུག་ག ཡིན་ནས་དེང་སང་ཁྱི་སྐྱག་བདེ་པོ་རང་མེད་ཙང་མཚན་ལྟོ་རྒྱག་ཡ་དེ་ཆོས་མཛད་རང་ནས་བྱས་ན་འགྲིག་པ་འདུག་གས་ཞེས་བཤད་པར། བསྟན་པས་འགྲིག་དང་འགྲིག མཚན་ལྟོ་ངས་བརྒྱག་ཆོག ,sha shed yag po rgyas 'dug ga_yin nas deng sang khyi skyag bde po rang med tsang mtshan lto rgyag ya de chos mdzad rang nas byas na 'grig pa 'dug gas zhes bshad par/_bstan pas 'grig dang 'grig_mtshan lto ngas brgyag chog_,https://d38pmlk0v88drf.cloudfront.net/wav16k/STT_AB00305_0079_805810_to_817738.wav,STT_AB,3,174,11.928,wav16k/STT_AB00305_0079_805810_to_817738.wav,ཤ་ཤེད་ཡག་པོ་བརྒྱལ་འདུག་ག ཡིན་ནས་དེང་སང་ཁྱི་སྐྱག་བདེ་པོ་རང་མེད་ཙང་མཚན་ལཐོ་རྒྱག་ཡ་དེ་ཆུས་མཛད་རང་ནས་བྱས་ན་འགྲིག་པ་འདུག་གེ་ཞེས་བཤད་པར་བསྟན་པས་འགྲིག་དང་འགྲིག ཚན་ལཐོ་ངས་བརྒྱབ་ཆོག
STT_AB00305_0081_829667_to_841595,མ་བཤད་པ་རེད། ཁྱི་སྐྱག་ནི་དེ་ལྟར་བྱས་ནས་ཉིན་མ་བསྐྱལ་བར་བརྟེན་ལུས་སྟོབས་ཀྱང་ཇེ་ཞན་དུ་སོང་ནས་ཕྱི་ལས་ལ་འགྲོ་སྐབས་ཀྱང་གཞོན་ནུ་འདྲ་འདྲའི་དཀྱིལ་ལ་ལས་གྲལ་མི་ཤོགས་པ་དང་། ཕོ་གསར་འཛོམས་ནས་ ,ma bshad pa red/_khyi skyag ni de ltar byas nas nyin ma bskyal bar brten lus stobs kyang je zhan du song nas phyi las la 'gro skabs kyang gzhon nu 'dra 'dra'i dkyil la las gral mi shogs pa dang /_pho gsar 'dzoms nas _,https://d38pmlk0v88drf.cloudfront.net/wav16k/STT_AB00305_0081_829667_to_841595.wav,STT_AB,3,178,11.928,wav16k/STT_AB00305_0081_829667_to_841595.wav,སྨྲ་བཤད་པ་རེད། ཁྱི་སྐྱག་ནི་དེ་ལྟར་བྱས་ནས་ཉིན་མོ་རྒྱལ་བར་བརྟེན་ལུས་སྟོབས་ཀྱང་ཇེ་ཞན་དུ་སོང་ནས་ཆིད་ལས་ལ་འགྲོ་སྐབས་ཀྱང་གཞོན་ནུ་འདྲ་འདྲའི་དཀྱིལ་ལ་ལས་གྲལ་མི་ཤོག་པ་དང་། ཕོ་གསར་འཛོམས་ནས་
STT_AB00305_0086_886194_to_895213,ཟ་རི་ཟི་རིའི་ངང་ནས་རང་གི་བཞོན་རྟ་རྐྱང་པོར་དེར་རྟ་སྒ་བརྒྱབས་ནས་ཁྲིད་ཡོང་སྟེ་རྒྱུག་ཐང་གི་འགྲམ་དུ་སླེབས་སྐབས། བསྟན་པས་རྟ་སྒ་སྒ་སྐོར་ལ་ཞིབ་ལྟ་ཞིག་བྱས་པས་ ,za ri zi ri'i ngang nas rang gi bzhon rta rkyang por der rta sga brgyabs nas khrid yong ste rgyug thang gi 'gram du slebs skabs/_bstan pas rta sga sga skor la zhib lta zhig byas pas _,https://d38pmlk0v88drf.cloudfront.net/wav16k/STT_AB00305_0086_886194_to_895213.wav,STT_AB,3,150,9.019,wav16k/STT_AB00305_0086_886194_to_895213.wav,ཟ་རི་ཟི་རིལ་ངང་ནས་རང་གི་བཞོན་རྟ་རྐྱང་པོ་དེར་རྟ་ྒ་བརྒྱབ་ནས་ཁྲིད་ཡོང་སྟེ་རྒྱུག་ཐང་གི་འགྲམ་དུ་སླེབས་སྐབས་བསྟན་པས་རྟ་ཁ་སྒ་སྐོར་ལ་ཡ་ཞིབ་ལྟ་ཞིག་བྱས་པས་
STT_AB00305_0094_952653_to_961100,སྐེ་རགས་འཛར་ན་འཛར་ཆང་ཞེས་ཉེས་པ་གཏོང་སྲོལ་ཡོད་པ་དང་། རྟ་ཡིས་གཡུགས་ན་གཡུགས་ཆང་ཞེས་ཉེས་པ་གཏོང་སྲོལ་ཡོད་པས་དེ་གར་ཡོད་པའི་འགྲན་བསྡུར་དོ་དམ་པ་ཞིག་གིས་ ,ske rags 'dzar na 'dzar chang zhes nyes pa gtong srol yod pa dang /_rta yis g.yugs na g.yugs chang zhes nyes pa gtong srol yod pas de gar yod pa'i 'gran bsdur do dam pa zhig gis _,https://d38pmlk0v88drf.cloudfront.net/wav16k/STT_AB00305_0094_952653_to_961100.wav,STT_AB,3,145,8.447,wav16k/STT_AB00305_0094_952653_to_961100.wav,ཀ་རག་འཛར་ན་འཛར་ཆང་ཞེས་ཉེས་པོ་གཏོང་སྲོལ་ཡོད་པ་དང་། རྟ་ཡིས་གཡུག་ན་གཡུག་ཆང་ཞེས་མཉེས་པོ་གཏོང་སྲོལ་ཡོད་པས་དེ་གར་ཡོད་པའི་འགྲན་སྡུར་དོ་དམ་པ་ཞིག་གིས་
STT_AB00305_0096_970554_to_976220,དེ་གར་ལྟད་མོ་བལྟ་བར་སླེབས་ཡོད་པའི་སྐྱིད་པ་ལགས་དང་བུ་མོ་ཆུང་སྐྱིད་ནང་དུ་ཆང་ལེན་པར་སོང་།  ,de gar ltad mo blta bar slebs yod pa'i skyid pa lags dang bu mo chung skyid nang du chang len par song /__,https://d38pmlk0v88drf.cloudfront.net/wav16k/STT_AB00305_0096_970554_to_976220.wav,STT_AB,3,88,5.666,wav16k/STT_AB00305_0096_970554_to_976220.wav,དེ་གར་ལྟད་མོར་ལྟ་བ་སླེབས་ཡོད་པས་སྐྱིད་པ་ལགས་དང་བུ་མོ་ཆུང་སྐྱིད་ནང་དུ་ཆང་ལེན་པར་སོང་།
