file_name,uni,wylie,url,dept,grade,char_len,audio_len,path,inf
STT_AB00306_0031_295048_to_305708,ཤིང་བད་ཀྱི་འོག་ནས་སྒམ་ཆུང་གི་ཟུར་ཞིག་མཐོང་ནས་ཕར་ཕྱིན་ནས་ཤིང་བད་ཡར་བཀྱགས་ནས་བལྟས་པས། རྟ་མགྲིན་གྱི་ཙག་ཙིག་བླུག་སའི་སྒམ་ཆུང་དེ་ཡིན་པ་ཤེས་ཏེ་ཁྱི་སྐྱག་ཡར་བོས་ནས་ ,shing bad kyi 'og nas sgam chung gi zur zhig mthong nas phar phyin nas shing bad yar bkyags nas bltas pas/_rta mgrin gyi tsag tsig blug sa'i sgam chung de yin pa shes te khyi skyag yar bos nas _,https://d38pmlk0v88drf.cloudfront.net/wav16k/STT_AB00306_0031_295048_to_305708.wav,STT_AB,3,157,10.66,wav16k/STT_AB00306_0031_295048_to_305708.wav,ཤིང་ྦས་ཀྱི་འོག་ནས་སྒམ་ཆུང་གི་ཟུར་ཞིག་མཐོང་ནས་ཕར་ཕྱིན་ནས་ཤིང་ྦས་ཡར་བཀྱགས་ནས་བལྟས་པས་ རྟ་མགྲིན་གྱིས་ཙག་ཙིག་བླུག་སའི་སྒམ་ཆུང་དེ་ཡིན་པ་ཤེས་ཏེ་ཁྱི་སྐྱག་ཡར་འབོས་ནས་
STT_MV0679_0254_1825036_to_1832869,རང་གི་ལུས་ཤེས་ཀི་ཚོར་བ་དང་སེམས་ལ་བརྟེན་བྱས་རིམ་བཞིན་ལག་པའི་ནང་གི་གྲོ་ཞིབ་དེ་མྱོང་ཚོར་ཐུབ་པ་གྱིས་དང་།  ,rang gi lus shes ki tshor ba dang sems la brten byas rim bzhin lag pa'i nang gi gro zhib de myong tshor thub pa gyis dang /__,https://d38pmlk0v88drf.cloudfront.net/wav16k/STT_MV0679_0254_1825036_to_1832869.wav,STT_MV,3,102,7.833,wav16k/STT_MV0679_0254_1825036_to_1832869.wav,རང་གི་ལུས་ཤེས་ཀི་ཚོར་བ་དང་སེམས་ལ་བརྟེན་བྱས་རིམ་བཞིན་ལག་པའི་ནང་གི་གྲོ་ཞིབ་དེ་མྱོང་ཚོར་ཐུབ་པ་གྱིས་ད།
STT_MV0065_0030_335211_to_337490,ང་ནི་དངངས་སྐྲག་གིས་བརྗེད་ཤག ,nga ni dngangs skrag gis brjed shag_,https://d38pmlk0v88drf.cloudfront.net/wav16k/STT_MV0065_0030_335211_to_337490.wav,STT_MV,3,28,2.279,wav16k/STT_MV0065_0030_335211_to_337490.wav,ང་ནི་དངང་སྐྲག་གིས་བརྗེད་ཤག
STT_AB00306_0037_343558_to_347517,གད་པ་གཉིས་ནས་ཁོའི་ལག་པ་ཐག་པས་བསྡམས་རྩིས་བྱེད་སྐབས་སྐྱིད་པ་ལགས་ཀིས་ ,gad pa gnyis nas kho'i lag pa thag pas bsdams rtsis byed skabs skyid pa lags kis _,https://d38pmlk0v88drf.cloudfront.net/wav16k/STT_AB00306_0037_343558_to_347517.wav,STT_AB,3,67,3.959,wav16k/STT_AB00306_0037_343558_to_347517.wav,གད་པ་གཉིས་ནས་ཁོའི་ལག་པ་ཐག་པས་བསྡམ་རྩིས་བྱེད་སྐབས་སྐྱིད་པ་ལགས་ཀྱིས་
STT_MV0679_0265_1889297_to_1898878,སེམས་པ་སྐྱིད་པོ་དང་ཁོ་ཚོས་རང་གིས་བཟོས་པའི་ཟས་རིགས་འདི་བཟས་བྱས་སྤྲོ་སྣང་ལྡན་པ་གཅིག་དགོས་ཀི་ཡོད་ན་ཐོག་མར་གལ་ཆེ་ཤོས་དེ་རང་གིས་སོ་སོའི་སྤྲོ་སྣང་དང་བདེ་སྐྱིད་འདི་གྲོ་ཞིབ་ལ་བརྒྱུད་སྤྲོད་བྱེད་ཐུབ་པ་དགོས་རེད་ ,sems pa skyid po dang kho tshos rang gis bzos pa'i zas rigs 'di bzas byas spro snang ldan pa gcig dgos ki yod na thog mar gal che shos de rang gis so so'i spro snang dang bde skyid 'di gro zhib la brgyud sprod byed thub pa dgos red _,https://d38pmlk0v88drf.cloudfront.net/wav16k/STT_MV0679_0265_1889297_to_1898878.wav,STT_MV,3,201,9.581,wav16k/STT_MV0679_0265_1889297_to_1898878.wav,སེམས་པ་སྐྱིད་པོ་དང་ཁོང་ཚོས་རང་གིས་བཟོས་པའི་ཟ་རིགས་འདི་བཟས་བྱས་སྤྲོ་སྣང་ལྡན་པ་གཅིག་དགོས་ཀི་ཡོད་ན། ཐོག་མར་གལ་ཆེ་ཤོས་དེ་རང་གིས་སོ་སོའི་སྤྲོ་སྣང་དང་བདེ་སྐྱིད་དི་གྲོ་ཞིབ་དི་བརྒྱུད་སྤྲོད་བྱེད་ཐུབས་དགོས་རེད།
STT_PC0165_0287_1883151_to_1887279,རྩ་བ་ཉིད་ནས་བཏང་གི་མི་འདུག་སེ། ལོ་དེ་ག་སེ་སླེབས་པ་རེད་དེ། རང་གི་ཉིན་མ་གཅིག་ལ་ལུས་འབྲེལ་སྒང་ལ་ཡར་རྒྱས་གཏང་གི་མི་འདུག་སེ།  ,rtsa ba nyid nas btang gi mi 'dug se/_lo de ga se slebs pa red de/_rang gi nyin ma gcig la lus 'brel sgang la yar rgyas gtang gi mi 'dug se/__,https://d38pmlk0v88drf.cloudfront.net/wav16k/STT_PC0165_0287_1883151_to_1887279.wav,STT_PC,3,121,4.128,wav16k/STT_PC0165_0287_1883151_to_1887279.wav,རྩ་བ་ཉིད་ནས་གཏང་གི་མི་འདུག་ཟེ། ལོ་དེ་ག་ཙེ་སླེབས་པ་རེད་དེ། རང་གི་ཉི་མ་གཅིག་ལ་ལུས་འབྲེལ་སྒང་ལ་ཡར་རྒྱས་གཏང་གི་མི་འདུག་ཟེ།
STT_PC0165_0297_1959104_to_1962841,དེ་ནས་ངས་མོ་རང་དྲིས་པ་ཡིན། ད་སུའི་ནོར་འཁྲུལ་རེད་སེ་ལབ་དུས་ཙམ་པ། དེ་ཁོ་རང་ནོར་འཁྲུལ་རེད་སེ།  ,de nas ngas mo rang dris pa yin/_da su'i nor 'khrul red se lab dus tsam pa/_de kho rang nor 'khrul red se/__,https://d38pmlk0v88drf.cloudfront.net/wav16k/STT_PC0165_0297_1959104_to_1962841.wav,STT_PC,3,92,3.737,wav16k/STT_PC0165_0297_1959104_to_1962841.wav,དེ་ནས་ངས་མོ་རང་དྲིས་པ་ཡིན། ད་སུའི་ནོར་འཁྲུལ་རེད་ཟེ་ལབ་དུས་ཙམ་པ། དེ་ཁོ་རང་ནོར་འཁྲུལ་རེད་ཟེ།
STT_MV0755_0141_1298501_to_1307960,ཧན་ཧན། ད་ལྟ་རང་གིས། ངའི་དངུལ་ཚང་མ་ཆུ་ལ་གཡུགས་ཚར་པ་རེད། ཚུར་འཁྱེར་ཤོག་བྱས། ང་ག་རེ་ཡིན་ཟེ་དངངས་སྐྲག་ལང་དགོས་མ་རེད། དངངས་སྐྲག་ལང་དགོས་བྱུང་།  ,han han/_da lta rang gis/_nga'i dngul tshang ma chu la g.yugs tshar pa red/_tshur 'khyer shog byas/_nga ga re yin ze dngangs skrag lang dgos ma red/_dngangs skrag lang dgos byung /__,https://d38pmlk0v88drf.cloudfront.net/wav16k/STT_MV0755_0141_1298501_to_1307960.wav,STT_MV,3,139,9.459,wav16k/STT_MV0755_0141_1298501_to_1307960.wav,ད་ལྟ་རང་གིས་ངའས་དངུལ་ཚང་མ་ཕྱི་ལ་གཡུགས་ཚར་པ་རེད། ཚུར་སྐྱེས་ཤིག་བྱས། ང་ག་རེ་ཡིན་ཟེར་དངང་སྐྲག་ལང་དགོས་མ་རེད། དངང་སྐྲག་ལང་དགོས་བྱུང་།
STT_AB00306_0049_435947_to_448946,ནམ་ཞིག་ཆུ་དྭངས་གྲམ་གསལ་གྱིས་དཀར་ས་ནག་ཐོན་དང་། ཡིན་མིན་གསལ་འབྱེད་ཀྱིས་ད་ལྟའི་གནས་ཚུལ་མ་ཡིན་པ་ཞིག་བྱུང་པ་ཡིན་ན་བཀའ་ཆད་ནན་པོ་ཕོག་ངེས་རེད་ལ་དེ་ཚེ་རྗེས་ཡོང་སྔོན་དྲན་བྱེད་ཐུབ་པ་བྱེད་དགོས་རེད། དེ་མ་ཡིན་པར་རྗེས་སུ་འགྱོད་པ་སྐྱེ་དགོས་བྱུང་པ་ཡིན་ན་ ,nam zhig chu dwangs gram gsal gyis dkar sa nag thon dang /_yin min gsal 'byed kyis da lta'i gnas tshul ma yin pa zhig byung pa yin na bka' chad nan po phog nges red la de tshe rjes yong sngon dran byed thub pa byed dgos red/_de ma yin par rjes su 'gyod pa skye dgos byung pa yin na _,https://d38pmlk0v88drf.cloudfront.net/wav16k/STT_AB00306_0049_435947_to_448946.wav,STT_AB,3,238,12.999,wav16k/STT_AB00306_0049_435947_to_448946.wav,ནམ་ཞིག་ཆུ་དངས་བྲམ་ཟེར་གྱིས་དཀར་ཟ་ནག་དོན་དང་ཡིན་མིན་གསལ་བྱེད་ཀྱི་ད་ལྟའི་གནས་ཚུལ་མ་ཡིན་པ་ཞིག་བྱུང་པ་ཡིན་ན། དཀའ་བྱས་ནན་པོ་ཕོག་ངེས་རེད་ལ། དེ་རཚིས་ྗེ་ཡོང་སྔོན་འབྲལ་བྱེད་ཐུབ་པ་བྱེད་དགོས་རེད། དེ་མ་ཡིན་པ་བྱས། རྗེས་སུ་འགྱོད་པ་སྐྱེ་དགོས་བྱུང་པ་ཡིན་ན།
STT_AB00305_0178_1700837_to_1711476,པ་དང་། ཡང་ན་རྣམ་འགྱུར་གྲང་ཤུར་ཤུར་ཁོ་ན་སྟོན་པའི་འགོ་ཚུགས་ཏེ་བསྟན་པ་ནི་བཟོད་མི་བདེ་བ་ཙམ་བྱུང་ན་ཡང་། རང་གི་རྣམ་འགྱུར་ལ་འགྱུར་བ་མེད་པར་སྔར་མུས་ལྟར་སྣང་མེད་ངང་བསྡད།  ,pa dang /_yang na rnam 'gyur grang shur shur kho na ston pa'i 'go tshugs te bstan pa ni bzod mi bde ba tsam byung na yang /_rang gi rnam 'gyur la 'gyur ba med par sngar mus ltar snang med ngang bsdad/__,https://d38pmlk0v88drf.cloudfront.net/wav16k/STT_AB00305_0178_1700837_to_1711476.wav,STT_AB,3,162,10.639,wav16k/STT_AB00305_0178_1700837_to_1711476.wav,དང་། ཡང་ན་རྣམ་འགྱུར་གྲང་ཤུང་ཤུང་ཁོ་ན་སྟོན་པས་འགོ་ཚུགས་ཏེ་ བསྟན་པ་ནི་བཟོད་མི་བདེ་བ་ཙམ་བྱུང་ཡང་རང་གི་རྣམ་འགྱུར་ལ་འགྱུར་བ་མེད་པར་སྔ་མུས་ལྟར་སྣང་མེད་ངང་བསྡད།
STT_PC0165_0289_1899104_to_1905366,རང་ལ་ནི་དགོས་ཀི་མི་འདུག་སེ། ད་རང་ལ་ངའི་བུ་གུ་རེད། རང་ཁྱིམ་ཚང་དེ་ལ་ངས་ཡོད་ཚད་སྤྲད་ཐུབ་ཀི་ཡོད་སེ། ད་ཁོ་རང་ངུས་བྱས་ནས་པུས་མོ་བཙུགས་ཤག ,rang la ni dgos ki mi 'dug se/_da rang la nga'i bu gu red/_rang khyim tshang de la ngas yod tshad sprad thub ki yod se/_da kho rang ngus byas nas pus mo btsugs shag_,https://d38pmlk0v88drf.cloudfront.net/wav16k/STT_PC0165_0289_1899104_to_1905366.wav,STT_PC,3,131,6.262,wav16k/STT_PC0165_0289_1899104_to_1905366.wav,རང་ལ་ནི་དགོས་ཀི་མི་འདུག་ཟེ། ད་རང་ལ་ངའི་བུ་གུ་རེད། རང་ཁྱིམ་ཚང་དེ་ལ་ངས་ཡོད་ཚད་སྤྲད་ཐུབ་ཀི་ཡོད་ཟེ། ད་ཁོ་རང་ངོས་བྱས་པུས་མོ་བཙུགས་ཤག
STT_AB00305_0180_1721467_to_1730998,ང་ཚོའི་བོང་བུ་དེ་ཚོ་ཤེད་མོ་ཡག་པོ་ཡོད་པ་ཡིན་ནས་ཨ་ལི་དང་། རྒྱའུ་མ་གཏོགས་གཞན་དག་གསུམ་ག་ན་བརྒྱད་པ་དགུ་པར་སླེབས་ཡོད་ཙང་རྒས་ཚབ་ཅིག་ཉོ་རན་བཞག ,nga tsho'i bong bu de tsho shed mo yag po yod pa yin nas a li dang /_rgya'u ma gtogs gzhan dag gsum ga na brgyad pa dgu par slebs yod tsang rgas tshab cig nyo ran bzhag_,https://d38pmlk0v88drf.cloudfront.net/wav16k/STT_AB00305_0180_1721467_to_1730998.wav,STT_AB,3,135,9.531,wav16k/STT_AB00305_0180_1721467_to_1730998.wav,ང་ཚོའི་བོང་བུ་དེ་ཚོ་ཤེད་མོ་ཡག་པོ་ཡོད་པ་ཡིན་ནས་ཨ་ལི་དང་རྒྱའུ་མ་གཏོགས་གཞན་དག་གསུམ་ཀ་ན་བརྒྱད་པ་དང་གུ་པར་སླེབས་ཡོད་ཙང་རྒྱལ་ཚབ་ཅིག་ཉོ་རས་ཤག
STT_AB00305_0185_1759337_to_1769240,ད་ལོ་སྒ་གཉིས་པ་ཡིན་ཙང་ལས་ཀ་སྐུལ་ཆོག་ཆོག་ཡིན་དཱ། གཟིགས་དང་གཟུགས་སྟོབས་ཆེ་ལ་ཤེད་མོ་ཡག་པོ་གང་འདྲ་མི་འདུག་གེ། ཞེས་སོགས་བོང་བུ་དེ་ཡག་རབས་མང་པོ་ཞིག་བཤད་པ་མ་ཟད།  ,da lo sga gnyis pa yin tsang las ka skul chog chog yin dA/_gzigs dang gzugs stobs che la shed mo yag po gang 'dra mi 'dug ge/_zhes sogs bong bu de yag rabs mang po zhig bshad pa ma zad/__,https://d38pmlk0v88drf.cloudfront.net/wav16k/STT_AB00305_0185_1759337_to_1769240.wav,STT_AB,3,155,9.903,wav16k/STT_AB00305_0185_1759337_to_1769240.wav,ད་ལོ་འགའ་གཉིས་པ་ཡིན་ཙང་ལས་ཀ་བསྐུལ་ཆོག་ཆོག་ཡིན་ད། གཟིགས་དང་། གཟུགས་སྟབས་བྱེད་ལ་ཤེལ་མོ་ཡག་པོ་གང་འདྲས་མི་འདུག་གེ་ཞེས་སོགས་བོང་བུ་དེ་ཡག་རབས་མང་པོ་ཅིག་བཤད་པ་མ་ཟད།
STT_PC0165_0298_1964121_to_1970196,རྒྱུ་མཚན་གང་ཡིན་ཟེར་ལབ་ན། ངའི་མི་ཚེ་གང་ཚང་ལ་མི་དེ་མཉམ་དུ་བསྡད་ནས་ད་ལྟ་བར་དུ་སྐྱེས་པ་གཅིག་ལ་ལག་པ་འཆང་མྱོང་མེད་སེ།  ,rgyu mtshan gang yin zer lab na/_nga'i mi tshe gang tshang la mi de mnyam du bsdad nas da lta bar du skyes pa gcig la lag pa 'chang myong med se/__,https://d38pmlk0v88drf.cloudfront.net/wav16k/STT_PC0165_0298_1964121_to_1970196.wav,STT_PC,3,114,6.075,wav16k/STT_PC0165_0298_1964121_to_1970196.wav,རྒྱུ་མཚན་གང་ཡིན་ཟེ་ལབ་ན། ངའི་མི་ཚེ་གང་ཚག་ལ་མི་དེ་མཉམ་དུ་བསྡད་ནས་ད་ལྟ་བར་དུ་སྐྱིས་པ་ཅིག་ལ་ལག་པ་འྱོག་མྱོང་མེད་ཟེ།
STT_PC0165_0303_2000145_to_2002653,ཁོ་རང་གིས་དམིགས་བསལ་ད་དུང་ག་རེ་བཤད་ཀི་འདུག་ཟེར་དུས་ཙམ་པ་ལ་ཡ།  ,kho rang gis dmigs bsal da dung ga re bshad ki 'dug zer dus tsam pa la ya/__,https://d38pmlk0v88drf.cloudfront.net/wav16k/STT_PC0165_0303_2000145_to_2002653.wav,STT_PC,3,62,2.508,wav16k/STT_PC0165_0303_2000145_to_2002653.wav,ཁོ་རང་གིས་དམིགས་བསལ་ད་དུང་ག་རེ་བཤད་ཀི་འདུག་ཟེར་དུས་ཙམ་པ་ལ་ཡ།
STT_PC0165_0309_2031885_to_2039018,ཡིན་ནས་མོ་རང་གིས་དེ་རྩ་བ་ཉིད་ནས་ལུས་འབྲེལ་ཟེར་ཡ་དེའི་སྒང་ལ་ཡ་ཅིག་དམིགས་བསལ་གིས་བྲོ་བ་ཅིག་མྱང་ཡ་ཡོད་པ་དང་། དེའི་གལ་ཆེན་པོ་ཡིན་པ་དང་།  ,yin nas mo rang gis de rtsa ba nyid nas lus 'brel zer ya de'i sgang la ya cig dmigs bsal gis bro ba cig myang ya yod pa dang /_de'i gal chen po yin pa dang /__,https://d38pmlk0v88drf.cloudfront.net/wav16k/STT_PC0165_0309_2031885_to_2039018.wav,STT_PC,3,133,7.133,wav16k/STT_PC0165_0309_2031885_to_2039018.wav,ཡིན་ནས་མོ་རང་གི་དེ་རྩ་བ་ཉིད་ནས་ལུས་འབྲེལ་ཟེར་ཡ་དེའི་སྒང་ལ་ཡ་ཅིག་དམིགས་བསལ་གི་བྲོ་བ་ཅིག་མྱང་ཡ་ཡོད་པ་དང་། དེ་གལ་ཆེན་པོ་ཡིན་པ་དང།
STT_MV0679_0267_1904335_to_1911172,སོ་སོའི་རེ་འདུན་བཟང་པོ་འདི་གྲོ་ཞིབ་པས་བརྒྱུད་སྤྲོད་བྱེད་དགོས་ཀི་ཡོད་པ་འདྲ། ཡོད་ཚད་གྲོ་ཞིབ་བརྫི་ཡ་ནས་འགོ་བཙུགས་རྒྱུ་རེད་ཤག ,so so'i re 'dun bzang po 'di gro zhib pas brgyud sprod byed dgos ki yod pa 'dra/_yod tshad gro zhib brdzi ya nas 'go btsugs rgyu red shag_,https://d38pmlk0v88drf.cloudfront.net/wav16k/STT_MV0679_0267_1904335_to_1911172.wav,STT_MV,3,122,6.837,wav16k/STT_MV0679_0267_1904335_to_1911172.wav,སོ་སོའི་རེ་འདུན་བཟང་པོ་དེ་གྲོ་ཞིབ་དེ་བརྒྱུད་སྤྲོད་བྱེད་དགོས་ཀི་ཡོད་པ་འདྲ། ཡོད་ཚད་གྲོ་ཞིབ་རྩི་ཡ་ནས་འགོ་བཙུགས་རྒྱུ་རེད་ཤག
STT_AB00306_0061_560005_to_571520,རྐུན་འཇལ་དང་བཀའ་ཉེས་སོགས་ཅི་བསྩལ་གུས་པ་རང་ནས་སྒྲུབ་འབུལ་ཞུས་ཆོག་པས། ལུས་སྟེང་དུ་བཀའ་ཁྲིམས་ཕྱག་ཡང་གང་འདྲ་གཅིག་ཡོད་པ་ཡིན་ནས་དེ་འདྲས་གཅིག་ཡོད་པ་མཁྱེན་ཞེས་བཤད་ནས་ཞྭ་མོ་ལག་གཉིས་ཀྱིས་བཟུང་ནས་ཕྱག་ ,rkun 'jal dang bka' nyes sogs ci bstsal gus pa rang nas sgrub 'bul zhus chog pas/_lus steng du bka' khrims phyag yang gang 'dra gcig yod pa yin nas de 'dras gcig yod pa mkhyen zhes bshad nas zhwa mo lag gnyis kyis bzung nas phyag _,https://d38pmlk0v88drf.cloudfront.net/wav16k/STT_AB00306_0061_560005_to_571520.wav,STT_AB,3,190,11.515,wav16k/STT_AB00306_0061_560005_to_571520.wav,སྐུན་མཇལ་དང་བཀའ་ཉེས་སོགས་དཔྱི་རྩའ་གུས་པ་རང་ནས་འྒྲོ་འབུལ་ཞུས་ཆོག་པས་ ལུས་སྟེང་དུ་བཀའ་ཁྲིམས་ཆག་ཡང་ག་འདྲས་གཅིག་ཡོད་པ་ཡིན་ནས་དེ་འདྲས་གཅིག་ཡོད་པ་མཁྱེན་ཞེས་བཤད་ནས་ཞྭ་མོ་ལག་གཉིས་ཀྱིས་བཟུང་ནས་ཇ་
STT_AB00306_0040_366501_to_379496,བའི་སྐབས་སུ་ཕན་ཞིག་འདོགས་ཐུབ་ན་ནི་ང་རང་ལ་ཡ་ལྟོས་ན་དྲིན་ལན་གསོ་བའི་གོ་སྐབས་ཤིག་ཀྱང་ཡིན་ལ་དྲིན་ཅན་ལ་ཆག་སྒོ་བྱུང་བའི་སྐབས་ལ་རོགས་པ་ཤིག་མ་བྱས་པ་ཡིན་ན་རྒྱུ་འབྲས་མེད་པར་ཡང་མི་འགྲོའམ་བསམས་ནས་སྐད་ཆེན་པོས་ ,ba'i skabs su phan zhig 'dogs thub na ni nga rang la ya ltos na drin lan gso ba'i go skabs shig kyang yin la drin can la chag sgo byung ba'i skabs la rogs pa shig ma byas pa yin na rgyu 'bras med par yang mi 'gro'am bsams nas skad chen pos _,https://d38pmlk0v88drf.cloudfront.net/wav16k/STT_AB00306_0040_366501_to_379496.wav,STT_AB,3,197,12.995,wav16k/STT_AB00306_0040_366501_to_379496.wav,བའི་སྐབས་སུ་ཕན་ཞིག་ལདོགས་ཐུབ་ན་ནི་ང་རང་ལ་ཡ་ལྟོས་ན་དྲིན་ལན་གཟོ་བའི་གོ་སྐབས་ཤིག་ཀྱང་ཡིན་ལ། དྲིན་ཅན་ལ་ཆགས་སྒོ་བྱུང་བའི་སྐབས་ལ་རོགས་པ་ཞིག་མ་བྱས་པ་ཡིན་ན་རྒྱུ་འབྲས་མེད་པར་ཡང་མིན་འགྲོའམ་བསམས་ནས་སྐད་ཆེན་པོས་
STT_AB00306_0042_386544_to_394923,སྐབས་དེར་ཁྱི་སྐྱག་གི་སེམས་ལ་ད་ཡིན་ན་འགྲིག་སོང་སྙམ་ནས། རེད། རེད། ཁོ་རེད། ད་ལོ་བོང་བུ་ཉོ་དུས་ཁོས་པ་ལགས་ལ་དངུལ་མང་པོ་ཞེ་དྲག་སྤྲད་སོང་། དེ་ཚོ་ཁོས་བརྐུས་པ་མིན་ན་ག་ ,skabs der khyi skyag gi sems la da yin na 'grig song snyam nas/_red/_red/_kho red/_da lo bong bu nyo dus khos pa lags la dngul mang po zhe drag sprad song /_de tsho khos brkus pa min na ga _,https://d38pmlk0v88drf.cloudfront.net/wav16k/STT_AB00306_0042_386544_to_394923.wav,STT_AB,3,159,8.379,wav16k/STT_AB00306_0042_386544_to_394923.wav,སྐབས་དེརང་ཁྱི་སྐྱག་གི་སེམས་ལ་ད་ཡིན་ན་འགྲིག་སོང་སྙམ་ནས་ རེད་རེད། ཁོ་རེད། ད་ལོ་བོང་བུ་ཉོ་དུས་ཁོས་པ་ལགས་ལ་དངུལ་མང་པོ་ཞེ་དྲག་སྤྲད་སོང་། དེ་ཚོ་ཁོས་བརྐུས་པ་ཡིན་ན་
STT_MV0679_0271_1929359_to_1937601,ང་ཚོ་མི་ཚང་གཅིག་གི་མི་རེད་ད། རེད། ནང་མི་ཟེར་མྱི་འདི་དགའ་པོ་བྱུང་དུས་མཉམ་དུ་སྤྲོ་སྣང་ལོངས་སྤྱོད་བྱས། སྡུག་པོ་བྱུང་དུས་སེམས་གསོ་གཏང་མྱི་རེད།  ,nga tsho mi tshang gcig gi mi red da/_red/_nang mi zer myi 'di dga' po byung dus mnyam du spro snang longs spyod byas/_sdug po byung dus sems gso gtang myi red/__,https://d38pmlk0v88drf.cloudfront.net/wav16k/STT_MV0679_0271_1929359_to_1937601.wav,STT_MV,3,140,8.242,wav16k/STT_MV0679_0271_1929359_to_1937601.wav,ང་ཚོ་མི་ཚང་གཅིག་གི་མི་རེད་ད། རེད། ནང་མི་ཟེར་མྱི་དེ་དགའ་བོ་བྱུང་དུས་མཉམ་དུ་སྤྲོ་སྣང་ལོངས་སྤྱོད་བྱས། སྡུག་པོ་བྱུང་དུས་སེམས་གསོ་གཏང་མྱི་རེད།
STT_MV0695_0283_2063585_to_2069107,ཨོ་ཡེ། བཀའ་འདྲི་ཞུ་རྒྱུ་ཁྱེད་རང་མ་བྱན་ཆེན་མོ་ཧང་ཧུང་རེད་པེ་ལ།  ,o ye/_bka' 'dri zhu rgyu khyed rang ma byan chen mo hang hung red pe la/__,https://d38pmlk0v88drf.cloudfront.net/wav16k/STT_MV0695_0283_2063585_to_2069107.wav,STT_MV,3,63,5.522,wav16k/STT_MV0695_0283_2063585_to_2069107.wav,ཝ་ཡེ། བཀའ་འདྲི་ཞུ་རྒྱུར་ཁྱེད་རང་མ་བྱན་ཆེན་མོ་ཧའ་ཕཱང་རེད་པེ་ལག།
STT_MV0937_0226_1930695_to_1938923,གལ་སྲིད་རྟ་ཚོང་རྒྱག་སར་བཙོངས་པ་ཡིན་ན། བུ་ལོན་སྤྲད་ཐུབ་པའི་མ་ཚད། ད་དུང་ལག་དངུལ་ཡེ་རག་གི་རེད། ངས་བལྟས་ན་དེ་གཅིག་གོ་ཉིས་ཆོད་རེད་ད།  ,gal srid rta tshong rgyag sar btsongs pa yin na/_bu lon sprad thub pa'i ma tshad/_da dung lag dngul ye rag gi red/_ngas bltas na de gcig go nyis chod red da/__,https://d38pmlk0v88drf.cloudfront.net/wav16k/STT_MV0937_0226_1930695_to_1938923.wav,STT_MV,3,129,8.228,wav16k/STT_MV0937_0226_1930695_to_1938923.wav,གལ་སྲིད་རྟ་ཚོང་བརྒྱག་ས་བཙོང་པ་ཡིན་ན། བུ་ལོན་སྤྲད་ཐུབ་པའི་མ་ཚད། ད་དུང་ལག་དངུལ་ཡེ་རག་གི་རེད། ངས་བལྟས་ན་དེ་གཅིག་པུ་ཉིས་གཅོས་རེད་ད།
